<?xml version="1.0" encoding="UTF-8"?>
<!--
  JBoss, Home of Professional Open Source
  Copyright 2008, Red Hat Middleware LLC, and individual contributors
  as indicated by the @author tags.
  See the copyright.txt in the distribution for a
  full listing of individual contributors.
  This copyrighted material is made available to anyone wishing to use,
  modify, copy, or redistribute it subject to the terms and conditions
  of the GNU Lesser General Public License, v. 2.1.
  This program is distributed in the hope that it will be useful, but WITHOUT A
  WARRANTY; without even the implied warranty of MERCHANTABILITY or FITNESS FOR A
  PARTICULAR PURPOSE.  See the GNU Lesser General Public License for more details.
  You should have received a copy of the GNU Lesser General Public License,
  v.2.1 along with this distribution; if not, write to the Free Software
  Foundation, Inc., 51 Franklin Street, Fifth Floor, Boston,
  MA  02110-1301, USA.

  (C) 2008,
  @author JBoss Inc.
-->
<xs:schema xmlns:xs="http://www.w3.org/2001/XMLSchema" elementFormDefault="qualified">
	<xs:element name="classpath">
		<xs:complexType>
			<xs:sequence maxOccurs="unbounded">
				<xs:element ref="directory" minOccurs="0" maxOccurs="unbounded"/>
				<xs:element ref="jar" minOccurs="0" maxOccurs="unbounded"/>
			</xs:sequence>
		</xs:complexType>
	</xs:element>
	<xs:element name="directory">
		<xs:complexType>
			<xs:attribute name="name" type="xs:decimal" use="required"/>
		</xs:complexType>
	</xs:element>
	<xs:element name="jar">
		<xs:complexType>
			<xs:attribute name="name" type="xs:string" use="required"/>
			<xs:attribute name="url" type="xs:anyURI" use="required"/>
		</xs:complexType>
	</xs:element>
	<xs:element name="param">
		<xs:simpleType>
			<xs:restriction base="xs:string">
				<xs:enumeration value="-clean"/>
				<xs:enumeration value="-dir"/>
				<xs:enumeration value="-nameservice"/>
				<xs:enumeration value="-plugin"/>
				<xs:enumeration value="-url"/>
				<xs:enumeration value="//bob101/NameService"/>
				<xs:enumeration value="c:/results/"/>
				<xs:enumeration value="org.jboss.dtf.testframework.coordinator.resultscollator.DatabaseResultsCollator"/>
				<xs:enumeration value="org.jboss.dtf.testframework.coordinator.resultscollator.PerformanceResultsCollator"/>
				<xs:enumeration value="org.jboss.dtf.testframework.dbmanager.plugins.MySQL"/>
				<xs:enumeration value="localhost:3306:dtf"/>
			</xs:restriction>
		</xs:simpleType>
	</xs:element>
	<xs:element name="parameters">
		<xs:complexType>
			<xs:sequence>
				<xs:element ref="param" maxOccurs="unbounded"/>
			</xs:sequence>
		</xs:complexType>
	</xs:element>
	<xs:element name="properties">
		<xs:complexType>
			<xs:sequence>
				<xs:element ref="property"/>
			</xs:sequence>
		</xs:complexType>
	</xs:element>
	<xs:element name="property">
		<xs:complexType>
			<xs:attribute name="name" type="xs:string" use="required"/>
			<xs:attribute name="value" type="xs:string" use="required"/>
		</xs:complexType>
	</xs:element>
	<xs:element name="service">
		<xs:complexType>
			<xs:sequence>
				<xs:element ref="classpath"/>
				<xs:element ref="parameters" minOccurs="0"/>
				<xs:element ref="properties" minOccurs="0"/>
			</xs:sequence>
			<xs:attribute name="name" type="xs:string" use="required"/>
			<xs:attribute name="class" use="required">
				<xs:simpleType>
					<xs:restriction base="xs:NMTOKEN">
						<xs:enumeration value="org.jboss.dtf.testframework.coordinator.resultscollator.ResultsCollator"/>
						<xs:enumeration value="org.jboss.dtf.testframework.dbmanager.DBManager"/>
						<xs:enumeration value="org.jboss.dtf.testframework.nameservice.NameService"/>
						<xs:enumeration value="org.jboss.dtf.testframework.productrepository.ProductRepository"/>
						<xs:enumeration value="org.jboss.dtf.testframework.serviceregister.ServiceRegister"/>
					</xs:restriction>
				</xs:simpleType>
			</xs:attribute>
			<xs:attribute name="timeout" type="xs:byte" use="required"/>
		</xs:complexType>
	</xs:element>
	<xs:element name="service_manager">
		<xs:complexType>
			<xs:sequence>
				<xs:element ref="service" maxOccurs="unbounded"/>
			</xs:sequence>
		</xs:complexType>
	</xs:element>
</xs:schema>
