<!--
  JBoss, Home of Professional Open Source
  Copyright 2008, Red Hat Middleware LLC, and individual contributors
  as indicated by the @author tags.
  See the copyright.txt in the distribution for a
  full listing of individual contributors.
  This copyrighted material is made available to anyone wishing to use,
  modify, copy, or redistribute it subject to the terms and conditions
  of the GNU Lesser General Public License, v. 2.1.
  This program is distributed in the hope that it will be useful, but WITHOUT A
  WARRANTY; without even the implied warranty of MERCHANTABILITY or FITNESS FOR A
  PARTICULAR PURPOSE.  See the GNU Lesser General Public License for more details.
  You should have received a copy of the GNU Lesser General Public License,
  v.2.1 along with this distribution; if not, write to the Free Software
  Foundation, Inc., 51 Franklin Street, Fifth Floor, Boston,
  MA  02110-1301, USA.

  (C) 2008,
  @author JBoss Inc.
-->
<service_manager xmlns:xsi="http:/www.w3.org/2001/XMLSchema-instance" xsi:noNamespaceSchemaLocation="./dtf-servicemanager.xsd">

	<!-- Configure Product Repository -->
	<service name="Product Repository" class="org.jboss.dtf.testframework.productrepository.ProductRepository" timeout="45">

		<classpath>
			<!-- ProductRepository requires use of TestingFramework classes -->
			<directory name="."/>
			<jar name="../lib/TestingFramework.jar"/>

			<!-- ProductRepository needs to parse XML product descriptions -->
			<jar name="../lib/ext/jdom.jar"/>
			<jar name="../lib/ext/xerces.jar"/>
		</classpath>

		<parameters>
			<param>-nameservice</param>
			<param>//localhost:1099/NameService</param>
		</parameters>

		<properties>
			<!-- set the RMI port number (default is 1099) -->
			<property name="rmi.port" value="1099"/>
		</properties>

	</service>

</service_manager>
